{"$id":"https://aluclu.org/schemas/alc_r0/v1/acquisition-receipt.schema.json","$schema":"https://json-schema.org/draft/2020-12/schema","additionalProperties":false,"properties":{"experiment_id":{"const":"alc-r0-smollm2-135m-v1"},"files":{"items":{"additionalProperties":false,"properties":{"byte_length":{"minimum":0,"type":"integer"},"path":{"minLength":1,"type":"string"},"sha256":{"pattern":"^[0-9a-f]{64}$","type":"string"}},"required":["byte_length","path","sha256"],"type":"object"},"maxItems":10,"minItems":10,"type":"array"},"inventory_sha256":{"pattern":"^[0-9a-f]{64}$","type":"string"},"repository":{"const":"HuggingFaceTB/SmolLM2-135M"},"revision":{"const":"93efa2f097d58c2a74874c7e644dbc9b0cee75a2"},"safetensors_only":{"const":true},"schema_id":{"const":"https://aluclu.org/schemas/alc_r0/v1/acquisition-receipt.schema.json"},"schema_version":{"const":1},"trust_remote_code":{"const":false}},"required":["experiment_id","files","inventory_sha256","repository","revision","safetensors_only","schema_id","schema_version","trust_remote_code"],"title":"ALC-R0 v1 acquisition receipt","type":"object"}