{"experiment_id":"alc-r0-smollm2-135m-v1","files":[{"byte_length":1519,"path":".gitattributes","sha256":"11ad7efa24975ee4b0c3c3a38ed18737f0658a5f75a0a96787b576a78a023361"},{"byte_length":6340,"path":"README.md","sha256":"d1ba68cae64a89b6b434b11526e6e2271ee5ffd2c914ec35ed515f9d84c6085c"},{"byte_length":704,"path":"config.json","sha256":"1d556eab73b69c7f11f64c557a2f9c6f440bd4c6b89bb2584a6b498c92603843"},{"byte_length":111,"path":"generation_config.json","sha256":"2056c988e990b0d13670f63f2f3b87b3b6d07edaf7a3416998ba27dab2d8a059"},{"byte_length":466391,"path":"merges.txt","sha256":"0b54e8aa4e53d5383e2e4bc635a56b43f9647f7b13832d5d9ecd8f82dac4f510"},{"byte_length":269060552,"path":"model.safetensors","sha256":"80521b40281d6ce74e35c9282c22539e75aa0ac8578892b2a59955ef78d55da1"},{"byte_length":831,"path":"special_tokens_map.json","sha256":"e786b595b9a23148bf1630df78d9037a048ea671e48bfd3549a1e3c233742bb3"},{"byte_length":2104556,"path":"tokenizer.json","sha256":"9ca9acddb6525a194ec8ac7a87f24fbba7232a9a15ffa1af0c1224fcd888e47c"},{"byte_length":3658,"path":"tokenizer_config.json","sha256":"4bb9af56a342753d39374f4016a16574cab299fe088e896f425ce3c433f61424"},{"byte_length":800662,"path":"vocab.json","sha256":"82b84012e3add4d01d12ba14442026e49b8cbbaead1f79ecf3d919784f82dc79"}],"inventory_sha256":"d9db0058a63990399f26b53ff7480f2e67bd5ef9a0398797fecfeb4ed9732b0e","repository":"HuggingFaceTB/SmolLM2-135M","revision":"93efa2f097d58c2a74874c7e644dbc9b0cee75a2","safetensors_only":true,"schema_id":"https://aluclu.org/schemas/alc_r0/v1/acquisition-receipt.schema.json","schema_version":1,"trust_remote_code":false}